{
  "schema_version": "1.0",
  "manifest_id": "stob_logic_die_floorplan_baseline_v1",
  "coordinate_system": {
    "origin": "logic_die_lower_left",
    "positive_x": "right",
    "positive_y": "up",
    "length_unit": "um",
    "bundle_anchor": "lower_left_element_center"
  },
  "die": {
    "x_um": 0.0,
    "y_um": 0.0,
    "width_um": 8000.0,
    "height_um": 12000.0
  },
  "evidence_snapshot": {
    "git_commit": "eb03227e05575d37e8046418c4302963acff567b",
    "working_tree_dirty": true,
    "captured_at": "2026-08-11T14:59:19.162391+00:00",
    "source_manifest_hashes": {
      "design/hbm2_architecture.json": "2A5E5B2676E57A28E21365BBDEEBE7CC60A1A5558727D2FAC1E9AC2F89B507F7",
      "design/hbm2_package.json": "D803B2BE498A3A4BE8917C5A67AF3563AE9FD417F04FAAC03A72C52D7362C8A6"
    }
  },
  "external_endpoints": [
    "package.interposer",
    "host",
    "vdd",
    "vss",
    "dram.channel[0]",
    "dram.channel[1]",
    "dram.channel[2]",
    "dram.channel[3]",
    "dram.channel[4]",
    "dram.channel[5]",
    "dram.channel[6]",
    "dram.channel[7]"
  ],
  "blocks": [
    {
      "instance": "top.logic_die_64ch_reduction_top",
      "module": "logic_die_64ch_reduction_top",
      "role": "cross-channel reduction",
      "x_um": 675.0,
      "y_um": 1100.0,
      "width_um": 650.0,
      "height_um": 4000.0,
      "orientation": "N",
      "area_source": "illustrative_adapter_tile",
      "placement_source": "deterministic_architecture_adapter_grid",
      "status": "illustrative",
      "dynamic_W": 0.49500000000000005,
      "leakage_W": 0.05500000000000001,
      "power_source": "estimated_4W_logic_die_allocation_for_relative_candidate_comparison",
      "clock_domain": "clk_i",
      "voltage_domain": "logic_vdd_unspecified",
      "traffic_endpoints": [
        "dram.channel[0]",
        "dram.channel[1]",
        "dram.channel[2]",
        "dram.channel[3]",
        "dram.channel[4]",
        "dram.channel[5]",
        "dram.channel[6]",
        "dram.channel[7]"
      ],
      "timing_criticality": 0.9,
      "movable": true,
      "halo_um": 25.0,
      "allowed_region": {
        "x_um": 250.0,
        "y_um": 800.0,
        "width_um": 7500.0,
        "height_um": 10950.0
      },
      "classification": "illustrative",
      "confidence": "low",
      "provenance": {
        "source_id": "floorplan_adapter",
        "source_path": "design/hbm2_architecture.json",
        "source_hash_sha256": "2A5E5B2676E57A28E21365BBDEEBE7CC60A1A5558727D2FAC1E9AC2F89B507F7",
        "description": "Adapted without changing RTL."
      }
    },
    {
      "instance": "top.bank_local_reduction_buffer",
      "module": "bank_local_reduction_buffer",
      "role": "bank reduction buffering",
      "x_um": 1675.0,
      "y_um": 1100.0,
      "width_um": 650.0,
      "height_um": 4000.0,
      "orientation": "N",
      "area_source": "illustrative_adapter_tile",
      "placement_source": "deterministic_architecture_adapter_grid",
      "status": "illustrative",
      "dynamic_W": 0.225,
      "leakage_W": 0.025,
      "power_source": "estimated_4W_logic_die_allocation_for_relative_candidate_comparison",
      "clock_domain": "clk_i",
      "voltage_domain": "logic_vdd_unspecified",
      "traffic_endpoints": [
        "dram.channel[4]",
        "dram.channel[5]",
        "dram.channel[6]",
        "dram.channel[7]"
      ],
      "timing_criticality": 0.45,
      "movable": true,
      "halo_um": 25.0,
      "allowed_region": {
        "x_um": 250.0,
        "y_um": 800.0,
        "width_um": 7500.0,
        "height_um": 10950.0
      },
      "classification": "illustrative",
      "confidence": "low",
      "provenance": {
        "source_id": "floorplan_adapter",
        "source_path": "design/hbm2_architecture.json",
        "source_hash_sha256": "2A5E5B2676E57A28E21365BBDEEBE7CC60A1A5558727D2FAC1E9AC2F89B507F7",
        "description": "Adapted without changing RTL."
      }
    },
    {
      "instance": "top.bank_local_fp16_reduction",
      "module": "bank_local_fp16_reduction",
      "role": "bank reduction arithmetic",
      "x_um": 2675.0,
      "y_um": 1100.0,
      "width_um": 650.0,
      "height_um": 4000.0,
      "orientation": "N",
      "area_source": "illustrative_adapter_tile",
      "placement_source": "deterministic_architecture_adapter_grid",
      "status": "illustrative",
      "dynamic_W": 0.405,
      "leakage_W": 0.045000000000000005,
      "power_source": "estimated_4W_logic_die_allocation_for_relative_candidate_comparison",
      "clock_domain": "clk_i",
      "voltage_domain": "logic_vdd_unspecified",
      "traffic_endpoints": [
        "dram.channel[0]",
        "dram.channel[1]",
        "dram.channel[2]",
        "dram.channel[3]"
      ],
      "timing_criticality": 0.75,
      "movable": true,
      "halo_um": 25.0,
      "allowed_region": {
        "x_um": 250.0,
        "y_um": 800.0,
        "width_um": 7500.0,
        "height_um": 10950.0
      },
      "classification": "illustrative",
      "confidence": "low",
      "provenance": {
        "source_id": "floorplan_adapter",
        "source_path": "design/hbm2_architecture.json",
        "source_hash_sha256": "2A5E5B2676E57A28E21365BBDEEBE7CC60A1A5558727D2FAC1E9AC2F89B507F7",
        "description": "Adapted without changing RTL."
      }
    },
    {
      "instance": "top.hierarchical_reduction_path",
      "module": "hierarchical_reduction_path",
      "role": "hierarchical reduction",
      "x_um": 4675.0,
      "y_um": 1100.0,
      "width_um": 650.0,
      "height_um": 4000.0,
      "orientation": "N",
      "area_source": "illustrative_adapter_tile",
      "placement_source": "deterministic_architecture_adapter_grid",
      "status": "illustrative",
      "dynamic_W": 0.49500000000000005,
      "leakage_W": 0.05500000000000001,
      "power_source": "estimated_4W_logic_die_allocation_for_relative_candidate_comparison",
      "clock_domain": "clk_i",
      "voltage_domain": "logic_vdd_unspecified",
      "traffic_endpoints": [
        "dram.channel[0]",
        "dram.channel[1]",
        "dram.channel[2]",
        "dram.channel[3]",
        "dram.channel[4]",
        "dram.channel[5]",
        "dram.channel[6]",
        "dram.channel[7]"
      ],
      "timing_criticality": 0.95,
      "movable": true,
      "halo_um": 25.0,
      "allowed_region": {
        "x_um": 250.0,
        "y_um": 800.0,
        "width_um": 7500.0,
        "height_um": 10950.0
      },
      "classification": "illustrative",
      "confidence": "low",
      "provenance": {
        "source_id": "floorplan_adapter",
        "source_path": "design/hbm2_architecture.json",
        "source_hash_sha256": "2A5E5B2676E57A28E21365BBDEEBE7CC60A1A5558727D2FAC1E9AC2F89B507F7",
        "description": "Adapted without changing RTL."
      }
    },
    {
      "instance": "top.logic_die_link_arbiter",
      "module": "logic_die_link_arbiter",
      "role": "TSV link arbitration",
      "x_um": 675.0,
      "y_um": 6500.0,
      "width_um": 650.0,
      "height_um": 4000.0,
      "orientation": "N",
      "area_source": "illustrative_adapter_tile",
      "placement_source": "deterministic_architecture_adapter_grid",
      "status": "illustrative",
      "dynamic_W": 0.18000000000000002,
      "leakage_W": 0.020000000000000004,
      "power_source": "estimated_4W_logic_die_allocation_for_relative_candidate_comparison",
      "clock_domain": "clk_i",
      "voltage_domain": "logic_vdd_unspecified",
      "traffic_endpoints": [
        "dram.channel[0]",
        "dram.channel[1]",
        "dram.channel[2]",
        "dram.channel[3]",
        "dram.channel[4]",
        "dram.channel[5]",
        "dram.channel[6]",
        "dram.channel[7]"
      ],
      "timing_criticality": 0.7,
      "movable": true,
      "halo_um": 25.0,
      "allowed_region": {
        "x_um": 250.0,
        "y_um": 800.0,
        "width_um": 7500.0,
        "height_um": 10950.0
      },
      "classification": "illustrative",
      "confidence": "low",
      "provenance": {
        "source_id": "floorplan_adapter",
        "source_path": "design/hbm2_architecture.json",
        "source_hash_sha256": "2A5E5B2676E57A28E21365BBDEEBE7CC60A1A5558727D2FAC1E9AC2F89B507F7",
        "description": "Adapted without changing RTL."
      }
    },
    {
      "instance": "top.logic_die_dual_link_arbiter",
      "module": "logic_die_dual_link_arbiter",
      "role": "dual-link arbitration",
      "x_um": 1675.0,
      "y_um": 6500.0,
      "width_um": 650.0,
      "height_um": 4000.0,
      "orientation": "N",
      "area_source": "illustrative_adapter_tile",
      "placement_source": "deterministic_architecture_adapter_grid",
      "status": "illustrative",
      "dynamic_W": 0.18000000000000002,
      "leakage_W": 0.020000000000000004,
      "power_source": "estimated_4W_logic_die_allocation_for_relative_candidate_comparison",
      "clock_domain": "clk_i",
      "voltage_domain": "logic_vdd_unspecified",
      "traffic_endpoints": [
        "dram.channel[0]",
        "dram.channel[1]",
        "dram.channel[2]",
        "dram.channel[3]",
        "dram.channel[4]",
        "dram.channel[5]",
        "dram.channel[6]",
        "dram.channel[7]"
      ],
      "timing_criticality": 0.7,
      "movable": true,
      "halo_um": 25.0,
      "allowed_region": {
        "x_um": 250.0,
        "y_um": 800.0,
        "width_um": 7500.0,
        "height_um": 10950.0
      },
      "classification": "illustrative",
      "confidence": "low",
      "provenance": {
        "source_id": "floorplan_adapter",
        "source_path": "design/hbm2_architecture.json",
        "source_hash_sha256": "2A5E5B2676E57A28E21365BBDEEBE7CC60A1A5558727D2FAC1E9AC2F89B507F7",
        "description": "Adapted without changing RTL."
      }
    },
    {
      "instance": "top.shared_fp16_pipeline_fabric",
      "module": "shared_fp16_pipeline_fabric",
      "role": "shared arithmetic fabric",
      "x_um": 2675.0,